<?xml version="1.0" encoding="UTF-8"?>
<!DOCTYPE biblioteca [
<!ELEMENT biblioteca (nombre, seccion+)>
<!ATTLIST biblioteca codigo CDATA #FIXED "B_67">

<!ELEMENT nombre (#PCDATA)>

<!ELEMENT seccion (libro+)>
<!ATTLIST seccion categoria (Novela|Ciencia_ficcion|Aventura|Historia) #REQUIRED>
<!ATTLIST seccion pasillo CDATA #IMPLIED>

<!ELEMENT libro (titulo, autor+, anio?, resumen?, editorial)>
<!ATTLIST libro id ID #REQUIRED>

<!ELEMENT titulo (#PCDATA)>
<!ELEMENT autor (#PCDATA)>
<!ENTITY tolkien "J.R.R. Tolkien">
<!ELEMENT anio (#PCDATA)>
<!ELEMENT resumen (#PCDATA)>

<!ELEMENT editorial (codigo?,nombre_editorial, ciudad)>
<!ELEMENT codigo (#PCDATA)>
<!ELEMENT nombre_editorial (#PCDATA)>
<!ELEMENT ciudad (#PCDATA)>

]>
<biblioteca codigo="B_67">
    <nombre>Biblioteca nacional</nombre>
    <seccion categoria="Aventura">
        <libro id="L1">
            <titulo>El señor de los anillos</titulo>
            <autor>J.R.R. Tolkien</autor>
            <resumen>Un viaje épico para destruir un anillo mágico.</resumen>
            <editorial>
                <nombre_editorial>Editorial Fantástica</nombre_editorial>
                <ciudad>Barcelona</ciudad>
            </editorial>
        </libro>
        <libro id="L2">
            <titulo>Harry Potter y la piedra filosofal</titulo>
            <autor>J.K. Rowling</autor>
            <anio>1997</anio>
            <resumen>Las aventuras de un joven mago en Hogwarts.</resumen>
            <editorial>
                <nombre_editorial>Ediciones Mágicasnomb_editorial</nombre_editorial>
                <ciudad>Londres</ciudad>
            </editorial>
        </libro>
    </seccion>
    <seccion categoria="Novela" pasillo="P3">
        <libro id="L3">
            <titulo>Cien años de soledad</titulo>
            <autor>Gabriel García Márquez</autor>
            <anio>1967</anio>
            <resumen>La historia de la familia Buendía en Macondo.</resumen>
            <editorial>
                <nombre_editorial>Ediciones Macondo</nombre_editorial>
                <ciudad>Bogotá</ciudad>
            </editorial>
        </libro>
    </seccion>
    <seccion categoria="Ciencia_ficcion">
        <libro id="L4">
            <titulo>1984</titulo>
            <autor>George Orwell</autor>
            <resumen>Un futuro distópico donde el pensamiento está
                controlado.</resumen>
            <editorial>
                <codigo>ED45TR</codigo>
                <nombre_editorial>Editorial Distopía</nombre_editorial>
                <ciudad>Londres</ciudad>
            </editorial>
        </libro>
        <libro id="L5">
            <titulo>Fundación</titulo>
            <autor>Isaac Asimov</autor>
            <anio>1951</anio>
            <resumen>La historia de la Fundación para prever el futuro
                galáctico.</resumen>
            <editorial>
                <nombre_editorial>Ediciones Galácticas</nombre_editorial>
                <ciudad>Nueva York</ciudad>
            </editorial>
        </libro>
    </seccion>
    <!-- Puedes agregar más secciones y libros según sea necesario -->
</biblioteca>